{
  "schemaVersion": "1.0",
  "contextKind": "SERVICE_ACCOUNT_PURPOSE_CLAIM",
  "profileId": "ethereum-usdc",
  "chainFamily": "EVM",
  "network": "MAINNET",
  "networkId": "1",
  "assetAddress": "0xa0b86991c6218b36c1d19d4a2e9eb0ce3606eb48",
  "query": {
    "kind": "BALANCE",
    "holder": {
      "address": "0x1111111111111111111111111111111111111111",
      "purpose": "DEPOSIT_REVIEW",
      "provenance": {
        "kind": "USER_STATEMENT",
        "referenceId": "example.synthetic.balance",
        "recordedAt": "2026-10-20T00:00:00.000Z",
        "scope": "ACCOUNT_PURPOSE_ONLY"
      }
    }
  }
}
